{
  "schemaVersion": 1,
  "workPackage": "WP-900",
  "definitionStatus": "DEFINED_NOT_EXECUTED",
  "releaseDecision": "NOT_READY",
  "gates": [
    {"id":"G0","title":"Canonical Completeness","currentStatus":"PARTIAL","purpose":"Verify that every mandatory release input has a canonical source and no missing specification is hidden by a PASS.","requiredEvidence":["Product/Architecture/Queue/State/Context/Gap/Flag/Rollback source map","missing-spec register"],"exitRule":"Every required source exists or is explicitly blocked with an Owner decision."},
    {"id":"G1","title":"Functional Completeness","currentStatus":"PARTIAL","purpose":"Evaluate every new Platform domain by observed product behavior, not source-file presence.","requiredEvidence":["domain success/failure/recovery evidence","cross-tool integration evidence"],"exitRule":"The rollout scope has no unresolved functional P0/P1 item."},
    {"id":"G2","title":"UX and Device Readiness","currentStatus":"UNTESTED","purpose":"Validate real devices, browsers, input methods, accessibility, and Pixel-Art workflow.","requiredEvidence":["device/browser matrix","Aseprite and current-mobile comparison"],"exitRule":"Every supported device/browser/input combination has required evidence."},
    {"id":"G3","title":"Performance and Memory","currentStatus":"PARTIAL","purpose":"Validate full compositor latency, Long Tasks, memory, bundle/request boundaries, and scale fixtures.","requiredEvidence":["formal p50/p95/max","memory/Long Task/raw-result evidence"],"exitRule":"Performance budgets pass on each supported scope or the scope remains unavailable."},
    {"id":"G4","title":"Legacy Compatibility","currentStatus":"UNTESTED","purpose":"Prove non-destructive compatibility with legacy PXD, Projects, PiXiSYNC, Market, Commerce, and Social data.","requiredEvidence":["read-only source hash/visual/reconciliation evidence","old/new client coexistence evidence"],"exitRule":"Affected legacy records remain resolvable with rollback proof."},
    {"id":"G5","title":"Security Permission and RLS","currentStatus":"UNTESTED","purpose":"Validate server authority, RLS/RPC, private visibility, safe paths, providers, and secret/PII boundaries.","requiredEvidence":["Production-equivalent denied/allowed/RLS/RPC tests","webhook/replay/idempotency evidence"],"exitRule":"No P0 security or privacy gap remains for the rollout scope."},
    {"id":"G6","title":"Production Integration Rehearsal","currentStatus":"UNTESTED","purpose":"Rehearse adapters and controls in an isolated Production-equivalent environment without changing Production.","requiredEvidence":["migration/storage dry-run","route/flag/kill/monitor/provider-adapter rehearsal"],"exitRule":"All required rehearsals are reproducible and fail closed."},
    {"id":"G7","title":"Migration and Rollback Rehearsal","currentStatus":"UNTESTED","purpose":"Apply the normative L0–L8 migration gates to an isolated rehearsal.","requiredEvidence":["backup/restore","identity/data/money/reconciliation/rollback evidence"],"exitRule":"Required L0–L8 gates pass for any proposed migration scope."},
    {"id":"G8","title":"Limited Rollout Readiness","currentStatus":"BLOCKED","purpose":"Define cohort, flags, thresholds, monitoring, rollback ownership, and observation without rolling out.","requiredEvidence":["staged rollout plan","rollback trigger/owner/observation window"],"exitRule":"Owner receives an evidence-backed limited-rollout plan after G0–G7 evaluation."},
    {"id":"G9","title":"Owner Release Approval","currentStatus":"BLOCKED","purpose":"Present the evidence and a non-automatic decision request to the Owner.","requiredEvidence":["signed acceptance summary","independent review/legal/accounting evidence where applicable"],"exitRule":"Only the Owner may select READY_FOR_LIMITED_ROLLOUT, NOT_READY, or BLOCKED."}
  ],
  "acceptanceItems": [
    {"id":"g0-product-specs","gate":"G0","domain":"canonical","title":"Product specifications and reconstruction provenance","currentStatus":"PARTIAL","priority":"P1_REQUIRED","releaseScope":["ALL"],"sourceRefs":["03_PRODUCTS/PIXIEEDRAW2_SPEC.md","03_PRODUCTS/PIXIGAME_SPEC.md","03_PRODUCTS/PIXIRUNTIME_SPEC.md","docs/inventory/wp160-canonical-spec-provenance.json"],"requiredEvidence":["All release-scope product specifications and reconstruction status reviewed."]},
    {"id":"g0-architecture-contracts","gate":"G0","domain":"canonical","title":"Architecture, permission, storage, feature-flag, and rollback contracts","currentStatus":"PARTIAL","priority":"P0_BLOCKER","releaseScope":["ALL"],"sourceRefs":["02_ARCHITECTURE/PIXIEED_CORE_SYSTEM.md","02_ARCHITECTURE/ACCOUNT_PERMISSION_CORE.md","02_ARCHITECTURE/FEATURE_FLAG_OBSERVABILITY_ROLLBACK_CORE.md"],"requiredEvidence":["No required contract is missing or contradicted for the proposed scope."]},
    {"id":"g0-work-package-wiring","gate":"G0","domain":"canonical","title":"Queue, State, Context Map, predecessor definitions, and Context","currentStatus":"PARTIAL","priority":"P1_REQUIRED","releaseScope":["ALL"],"sourceRefs":["00_START_HERE/IMPLEMENTATION_QUEUE.yaml","00_START_HERE/WORK_PACKAGE_CONTEXT_MAP.json",".codex/PIXIEED_IMPLEMENTATION_STATE.yaml"],"requiredEvidence":["Dependency graph and mandatory input map are structurally valid."]},
    {"id":"g0-gap-provenance","gate":"G0","domain":"canonical","title":"All existing Gap Inventory status references are aggregated","currentStatus":"PARTIAL","priority":"P0_BLOCKER","releaseScope":["ALL"],"sourceRefs":["docs/inventory/wp900-aggregated-release-gaps.json"],"requiredEvidence":["Every scanned source status is retained with a source reference."]},
    {"id":"g0-missing-production-specs","gate":"G0","domain":"canonical","title":"Production-equivalent environment, observability, and release-operation specifications","currentStatus":"UNTESTED","priority":"P0_BLOCKER","releaseScope":["ALL"],"sourceRefs":["CURRENT_SYSTEM_PRESERVATION_GATE.md","09_ROADMAP/MIGRATION_ACCEPTANCE_GATES.md"],"requiredEvidence":["Owner-approved missing-spec register and an environment-specific verification plan."]},
    {"id":"g0-bundle-baseline","gate":"G0","domain":"canonical","title":"Separate lazy-bundle baseline and measurement definition","currentStatus":"PARTIAL","priority":"P1_REQUIRED","releaseScope":["DRAW2","AUDIO","RUNTIME","COMMERCE","SOCIAL","ADMIN"],"sourceRefs":["docs/inventory/wp900-release-acceptance-matrix.json"],"requiredEvidence":["Raw/minified/gzip/Brotli baseline per chunk with source maps excluded."]},

    {"id":"g1-draw2-product","gate":"G1","domain":"draw2","title":"Professional Pixel Editing workflow and recovery","currentStatus":"PARTIAL","priority":"P1_REQUIRED","releaseScope":["DRAW2"],"sourceRefs":["docs/inventory/wp190-final-gap-inventory.json","docs/inventory/wp170-advanced-draw2.json"],"requiredEvidence":["Operational Pencil/Selection/Timeline/Onion/Advanced Tool success, cancel, undo, and recovery evidence."]},
    {"id":"g1-audio","gate":"G1","domain":"audio","title":"Audio project and asset workflow","currentStatus":"PARTIAL","priority":"P1_REQUIRED","releaseScope":["AUDIO"],"sourceRefs":["docs/inventory/wp190-final-gap-inventory.json","docs/inventory/wp190-performance.json"],"requiredEvidence":["Real audio asset workflow and browser/device integration evidence."]},
    {"id":"g1-game","gate":"G1","domain":"game","title":"Game authoring and Draw/Audio revision consumption","currentStatus":"PARTIAL","priority":"P1_REQUIRED","releaseScope":["RUNTIME"],"sourceRefs":["docs/inventory/wp190-final-gap-inventory.json","docs/inventory/wp200-boundary.json"],"requiredEvidence":["Cross-tool create/revise/preview/recover evidence."]},
    {"id":"g1-runtime","gate":"G1","domain":"runtime","title":"Runtime execution, Save State, and package compatibility","currentStatus":"PARTIAL","priority":"P1_REQUIRED","releaseScope":["RUNTIME"],"sourceRefs":["docs/inventory/wp160-draw-to-play-preview.json","docs/inventory/wp200-boundary.json"],"requiredEvidence":["Full runtime E2E, capability fallback, and save-state compatibility evidence."]},
    {"id":"g1-package-core","gate":"G1","domain":"core","title":"Project, Asset, Package, Search, and Notification integration","currentStatus":"PARTIAL","priority":"P1_REQUIRED","releaseScope":["ALL"],"sourceRefs":["09_ROADMAP/CORE_SITE_INTEGRATION_PROGRAM.md","docs/inventory/wp190-final-gap-inventory.json"],"requiredEvidence":["Cross-domain create to revise to package to recover flow evidence."]},
    {"id":"g1-market","gate":"G1","domain":"market","title":"Market Product, Rights, Purchase, Entitlement, Royalty, and Ledger projection","currentStatus":"PARTIAL","priority":"P0_BLOCKER","releaseScope":["COMMERCE"],"sourceRefs":["docs/inventory/wp210-boundary.json","docs/inventory/wp210-performance.json"],"requiredEvidence":["Production-equivalent purchase/entitlement/reconciliation evidence."]},
    {"id":"g1-direct-work","gate":"G1","domain":"direct-work","title":"Request, Quote, Agreement, Delivery, Rights, and Billing separation","currentStatus":"PARTIAL","priority":"P0_BLOCKER","releaseScope":["COMMERCE"],"sourceRefs":["docs/inventory/wp220-boundary.json","docs/inventory/wp220-performance.json"],"requiredEvidence":["Production-equivalent state-flow, money, and reconciliation evidence."]},
    {"id":"g1-social","gate":"G1","domain":"social","title":"Social, Community, Creator, and Market Card behavior","currentStatus":"PARTIAL","priority":"P1_REQUIRED","releaseScope":["SOCIAL"],"sourceRefs":["docs/inventory/wp230-gap.json","docs/inventory/wp230-performance.json"],"requiredEvidence":["Real-data-compatible social lifecycle, visibility, and recovery evidence."]},
    {"id":"g1-admin","gate":"G1","domain":"admin","title":"Admin Projection and Audit separation","currentStatus":"PARTIAL","priority":"P0_BLOCKER","releaseScope":["ADMIN"],"sourceRefs":["docs/inventory/wp240-boundary.json","docs/inventory/wp240-gap.json"],"requiredEvidence":["Server-authorized projection and non-replayable audit evidence."]},